<?xml version="1.0" encoding="UTF-8"?>
<gems xmlns:xsi="http://www.w3.org/2001/XMLSchema-instance" xmlns="https://example.com/gem"
      xsi:schemaLocation="https://example.com/gem schema_gems.xsd">
    <gem value="15">
        <name>Diamond</name>
        <preciousness>PRECIOUS</preciousness>
        <origin>Russia, Perm province</origin>
        <visual>
            <color>WHITE</color>
            <transparency>90</transparency>
            <cuttingMethod>DIAMOND</cuttingMethod>
        </visual>
    </gem>
    <gem value="25">
        <name>Emerald</name>
        <preciousness>PRECIOUS</preciousness>
        <origin>Colombia</origin>
        <visual>
            <color>GREEN</color>
            <transparency>60</transparency>
            <cuttingMethod>ROSE</cuttingMethod>
        </visual>
    </gem>
    <gem value="20">
        <name>Garnet</name>
        <preciousness>SEMIPRECIOUS</preciousness>
        <origin>Karelia</origin>
        <visual>
            <color>RED</color>
            <transparency>10</transparency>
            <cuttingMethod>ASHER</cuttingMethod>
        </visual>
    </gem>
</gems>
